{
  "format": "aiaeao.cube.vp04-projection-request/1",
  "profile": "P2-VP-GRANULARITY/0.4.0",
  "projection": {
    "budget": {
      "max_edges": 4,
      "max_items": 5
    },
    "focus": null,
    "granularity": "standard",
    "lens": "cube.lens.governance",
    "overflow": "summarize",
    "view": "cube.tree"
  },
  "reference_version": "v9.4",
  "source_bundle": {
    "basis": "declared_unverified",
    "facet_bindings": [
      {
        "basis": "declared_unverified",
        "declaration_ref": "fixture:VP04/tree_resources/semantics/evidence",
        "lens": "cube.lens.semantics",
        "note": "Authored fixture emphasis",
        "target_id": "evidence",
        "target_kind": "node"
      }
    ],
    "format": "aiaeao.cube.vp03-lens-bundle/1",
    "lens_profile": "P2-VP-LENSES/0.3.0",
    "reference_version": "v9.4",
    "source_view_sha256": "5b9f121c28ca76974cc9c930944b9e5f638fc4230e8e2a44944405aa426922a6",
    "view_plan": {
      "declaration_status": "declared_unverified",
      "edges": [
        {
          "arrow_anchor_id": "relation-arrows.reference",
          "declaration_ref": "fixture:VP02/tree/t2.1",
          "from": "resource",
          "predicate_id": "groups",
          "to": "artifact"
        },
        {
          "arrow_anchor_id": "relation-arrows.reference",
          "declaration_ref": "fixture:VP02/tree/t2.2",
          "from": "resource",
          "predicate_id": "groups",
          "to": "source"
        },
        {
          "arrow_anchor_id": "relation-arrows.reference",
          "declaration_ref": "fixture:VP02/tree/t2.3",
          "from": "resource",
          "predicate_id": "groups",
          "to": "cache"
        },
        {
          "arrow_anchor_id": "relation-arrows.reference",
          "declaration_ref": "fixture:VP02/tree/t2.4",
          "from": "artifact",
          "predicate_id": "groups",
          "to": "revision"
        },
        {
          "arrow_anchor_id": "relation-arrows.reference",
          "declaration_ref": "fixture:VP02/tree/t2.5",
          "from": "artifact",
          "predicate_id": "groups",
          "to": "evidence"
        }
      ],
      "granularity": "standard",
      "lens": "neutral",
      "nodes": [
        {
          "anchor_id": "resource-objects.resource",
          "form_id": "form.resource-card",
          "id": "resource",
          "label": "Resource collection"
        },
        {
          "anchor_id": "resource-objects.artifact",
          "form_id": "form.resource-card",
          "id": "artifact",
          "label": "Artifact"
        },
        {
          "anchor_id": "resource-objects.source",
          "form_id": "form.resource-card",
          "id": "source",
          "label": "Source"
        },
        {
          "anchor_id": "resource-objects.revision",
          "form_id": "form.resource-card",
          "id": "revision",
          "label": "Revision"
        },
        {
          "anchor_id": "resource-objects.evidence",
          "form_id": "form.resource-card",
          "id": "evidence",
          "label": "Evidence"
        },
        {
          "anchor_id": "resource-objects.cache",
          "form_id": "form.resource-card",
          "id": "cache",
          "label": "Cache"
        }
      ],
      "order": [
        "resource",
        "artifact",
        "source",
        "cache",
        "revision",
        "evidence"
      ],
      "printer_profile": "P2-VP-VIEWS/0.2.0",
      "reference_version": "v9.4",
      "root_id": "resource",
      "subtitle": "Explicitly authored grouping · no universal containment signature claimed",
      "title": "Resource family · Illustration",
      "view": "cube.tree"
    }
  },
  "source_bundle_sha256": "ccb1a5a6d611aa40f0bc0ab4c07e017ccbe74a59b4fe35a747f76078ab4579df"
}
