{
  "format": "aiaeao.cube.vp04-projection-request/1",
  "profile": "P2-VP-GRANULARITY/0.4.0",
  "projection": {
    "budget": {
      "max_edges": 1,
      "max_items": 2
    },
    "focus": null,
    "granularity": "overview",
    "lens": "cube.lens.execution",
    "overflow": "summarize",
    "view": "cube.flow"
  },
  "reference_version": "v9.4",
  "source_bundle": {
    "basis": "declared_unverified",
    "facet_bindings": [
      {
        "basis": "declared_unverified",
        "declaration_ref": "fixture:VP03/flow_migration/semantics/node/artifact",
        "lens": "cube.lens.semantics",
        "note": "Declared Artifact concept",
        "target_id": "artifact",
        "target_kind": "node"
      },
      {
        "basis": "declared_unverified",
        "declaration_ref": "fixture:VP03/flow_migration/semantics/node/resource",
        "lens": "cube.lens.semantics",
        "note": "Declared Resource concept",
        "target_id": "resource",
        "target_kind": "node"
      },
      {
        "basis": "declared_unverified",
        "declaration_ref": "fixture:VP03/flow_migration/semantics/edge/e1",
        "lens": "cube.lens.semantics",
        "note": "Declared references predicate",
        "target_id": "e1",
        "target_kind": "edge"
      },
      {
        "basis": "declared_unverified",
        "declaration_ref": "fixture:VP03/flow_migration/provenance/node/artifact",
        "lens": "cube.lens.provenance",
        "note": "Review the declared source artifact",
        "target_id": "artifact",
        "target_kind": "node"
      },
      {
        "basis": "declared_unverified",
        "declaration_ref": "fixture:VP03/flow_migration/provenance/edge/e1",
        "lens": "cube.lens.provenance",
        "note": "Review the reference declaration",
        "target_id": "e1",
        "target_kind": "edge"
      },
      {
        "basis": "declared_unverified",
        "declaration_ref": "fixture:VP03/flow_migration/execution/node/resource",
        "lens": "cube.lens.execution",
        "note": "Illustrative target for a possible operation",
        "target_id": "resource",
        "target_kind": "node"
      },
      {
        "basis": "declared_unverified",
        "declaration_ref": "fixture:VP03/flow_migration/governance/node/artifact",
        "lens": "cube.lens.governance",
        "note": "Inspect scope of declared object",
        "target_id": "artifact",
        "target_kind": "node"
      },
      {
        "basis": "declared_unverified",
        "declaration_ref": "fixture:VP03/flow_migration/governance/edge/e1",
        "lens": "cube.lens.governance",
        "note": "Inspect declaration boundary, not grant",
        "target_id": "e1",
        "target_kind": "edge"
      },
      {
        "basis": "declared_unverified",
        "declaration_ref": "fixture:VP03/flow_migration/epistemology/node/resource",
        "lens": "cube.lens.epistemology",
        "note": "Illustrative knowledge claim under review",
        "target_id": "resource",
        "target_kind": "node"
      }
    ],
    "format": "aiaeao.cube.vp03-lens-bundle/1",
    "lens_profile": "P2-VP-LENSES/0.3.0",
    "reference_version": "v9.4",
    "source_view_sha256": "c12f05d3648dd5052e3b010dac4103941d8b064e82e1a1b0137caeb2cb2c2a5c",
    "view_plan": {
      "declaration_status": "declared_unverified",
      "direction": "left-to-right",
      "edges": [
        {
          "arrow_anchor_id": "relation-arrows.reference",
          "declaration_ref": "P1.1:fixture/migration.binding-context.json#predicate_contracts/references",
          "from": "artifact",
          "predicate_id": "references",
          "to": "resource"
        }
      ],
      "granularity": "standard",
      "lens": "neutral",
      "nodes": [
        {
          "anchor_id": "resource-objects.artifact",
          "form_id": "form.resource-card",
          "id": "artifact",
          "label": "Artifact · migration A",
          "semantic_ref": "Y:α:Artifact[\"migration-artifact\"]"
        },
        {
          "anchor_id": "resource-objects.resource",
          "form_id": "form.resource-card",
          "id": "resource",
          "label": "Resource · migration R",
          "semantic_ref": "Y:α:Resource[\"migration-resource\"]"
        }
      ],
      "order": [
        "artifact",
        "resource"
      ],
      "printer_profile": "P2-VP-VIEWS/0.2.0",
      "reference_version": "v9.4",
      "subtitle": "Fixture: P1 migration relation · typing must be checked separately",
      "title": "Artifact → Resource · Migration",
      "view": "cube.flow"
    }
  },
  "source_bundle_sha256": "364e9b33d95ab0419410136287ac3f3e0d4e55ec8a7d5eaa66611dc26eaaf4ed"
}
