{
  "format": "aiaeao.cube.vp04-projection-request/1",
  "profile": "P2-VP-GRANULARITY/0.4.0",
  "projection": {
    "budget": {
      "max_edges": 8,
      "max_items": 4
    },
    "focus": null,
    "granularity": "detail",
    "lens": "cube.lens.execution",
    "overflow": "summarize",
    "view": "cube.flow"
  },
  "reference_version": "v9.4",
  "source_bundle": {
    "basis": "declared_unverified",
    "facet_bindings": [
      {
        "basis": "declared_unverified",
        "declaration_ref": "fixture:VP04/flow_research/semantics/annotation-c",
        "lens": "cube.lens.semantics",
        "note": "Authored fixture emphasis",
        "target_id": "annotation-c",
        "target_kind": "node"
      }
    ],
    "format": "aiaeao.cube.vp03-lens-bundle/1",
    "lens_profile": "P2-VP-LENSES/0.3.0",
    "reference_version": "v9.4",
    "source_view_sha256": "9b8b1feea9772bead05dff5b8bf6c77f741714892fe205efc788d3993e721e7d",
    "view_plan": {
      "declaration_status": "declared_unverified",
      "direction": "top-down",
      "edges": [
        {
          "arrow_anchor_id": "relation-arrows.reference",
          "declaration_ref": "fixture:VP02/relations/e1",
          "from": "annotation-a",
          "predicate_id": "related",
          "to": "annotation-b"
        },
        {
          "arrow_anchor_id": "relation-arrows.reference",
          "declaration_ref": "fixture:VP02/relations/e2",
          "from": "annotation-b",
          "predicate_id": "references",
          "to": "annotation-c"
        }
      ],
      "granularity": "standard",
      "lens": "neutral",
      "nodes": [
        {
          "anchor_id": "resource-objects.evidence",
          "form_id": "form.resource-card",
          "id": "annotation-a",
          "label": "Annotation / Claim A",
          "semantic_ref": "fixture:metaphysics/annotation-a"
        },
        {
          "anchor_id": "resource-objects.evidence",
          "form_id": "form.resource-card",
          "id": "annotation-b",
          "label": "Annotation / Claim B",
          "semantic_ref": "fixture:metaphysics/annotation-b"
        },
        {
          "anchor_id": "resource-objects.source",
          "form_id": "form.resource-card",
          "id": "annotation-c",
          "label": "Source / Claim C",
          "semantic_ref": "fixture:metaphysics/source-c"
        }
      ],
      "order": [
        "annotation-a",
        "annotation-b",
        "annotation-c"
      ],
      "printer_profile": "P2-VP-VIEWS/0.2.0",
      "reference_version": "v9.4",
      "subtitle": "Illustrative extension of P1 metaphysics fixture · declarations unverified",
      "title": "Annotation links · Research",
      "view": "cube.flow"
    }
  },
  "source_bundle_sha256": "c1138e213496330d255da84cac03bebf77dac603dc2739fe4259a9fc6b048ee9"
}
